date,issue,path,measurement_state,node_sequence,component_or_segment,from_voltage_v,to_voltage_v,resistance_ohm,estimated_current_ma,interpretation,source_note
2026-06-23,issue_05,b8a_pin1_to_ada4932_1_pin2,powered_on_short,"B8A Pin1 -> 50R -> 1.470k -> ADA4932_1 Pin2","B8A Pin1 to node after 50R",1.264,1.265,50,-0.02,"No meaningful drop across the 50 ohm section; current is near zero within measurement uncertainty.",user message 2026-06-23
2026-06-23,issue_05,b8a_pin1_to_ada4932_1_pin2,powered_on_short,"B8A Pin1 -> 50R -> 1.470k -> ADA4932_1 Pin2","1.470k section into ADA4932_1 Pin2",1.265,1.33,1470,-0.044,"Small reverse-signed voltage difference; this path is not strongly forcing ADA4932_1 Pin2 from B8A.",user message 2026-06-23
2026-06-23,issue_05,b8a_pin7_to_ada4932_1_pin3,powered_on_short,"B8A Pin7 -> 50R -> 1.457k -> ADA4932_1 Pin3","B8A Pin7 to node after 50R",1.2575,1.215,50,0.85,"Clear voltage drop across the 50 ohm section; this path is carrying substantial current compared with normal input bias current.",user message 2026-06-23
2026-06-23,issue_05,b8a_pin7_to_ada4932_1_pin3,powered_on_short,"B8A Pin7 -> 50R -> 1.457k -> ADA4932_1 Pin3","1.457k section into ADA4932_1 Pin3",1.215,-0.45,1457,1.143,"Large voltage drop into ADA4932_1 Pin3; Pin3 side is being pulled low by ADA4932_1 local input/feedback network or internal fault rather than by B8A output.",user message 2026-06-23
2026-06-23,issue_05,feedback_context,powered_off,"ADA4932_1 feedback network","all four ADA4932 feedback resistors",,,,1000,,"Corrected context remains: both ADA4932 stages have 1 kohm feedback resistors.",user message 2026-06-23
